{
  "componentId": "BUSButton",
  "name": "BUS Button",
  "category": "button",
  "status": "approved",
  "description": "BUSKvalitet custom button. Supports primary, outline-primary, outline-secondary, and text-primary variants. Sm/lg sizes. Built with React, not KendoReact.",
  "props": [
    { "name": "children", "type": "ReactNode", "required": true },
    { "name": "onClick", "type": "function", "required": false },
    { "name": "disabled", "type": "boolean", "required": false, "default": false },
    { "name": "className", "type": "string", "required": false },
    { "name": "id", "type": "string", "required": false }
  ],
  "variants": [
    { "name": "primary", "description": "bus-btn-primary — filled blue (#1548be), white text, hover $blue-700" },
    { "name": "outlinePrimary", "description": "bus-btn-outline-primary — white bg, blue inset shadow, blue text" },
    { "name": "outlineSecondary", "description": "bus-btn-outline-secondary — white bg, grey inset shadow, grey text" },
    { "name": "textPrimary", "description": "bus-btn-text-primary — no padding, blue text, white bg" },
    { "name": "sm", "description": "bus-btn-sm — compact padding ($sp-base $sp-8)" },
    { "name": "lg", "description": "bus-btn-lg — large padding ($sp-16 $sp-24), 17px" }
  ],
  "tokensConsumed": ["color.primary", "color.primary.hover", "color.text.white", "color.text.primary", "spacing.xs", "spacing.md", "spacing.lg", "radius.md"],
  "accessibility": { "role": "button", "keyboardSupport": true, "ariaProps": ["aria-disabled"] },
  "mapsFromHtml": ["button", "button.bus-btn", "button.bus-btn-primary"]
}
